{
  "$schema": "https://json-schema.org/draft/2020-12/schema",
  "title": "Agent Behavior OpenClaw Harness Adapter Plan",
  "type": "object",
  "additionalProperties": false,
  "required": [
    "adapter_id",
    "version",
    "created_at",
    "status",
    "target_runtime",
    "target_profile",
    "sandbox_contract_path",
    "mode",
    "case_selection",
    "runtime_controls",
    "outputs",
    "promotion_path",
    "quality_gate",
    "safety_assertions",
    "smoke_transcript",
    "tool_call_summaries"
  ],
  "properties": {
    "adapter_id": {
      "type": "string",
      "minLength": 1,
      "pattern": ".*\\S.*"
    },
    "version": {
      "type": "string",
      "minLength": 1,
      "pattern": ".*\\S.*"
    },
    "created_at": {
      "type": "string",
      "pattern": "^\\d{4}-\\d{2}-\\d{2}T\\d{2}:\\d{2}:\\d{2}Z$"
    },
    "status": {
      "type": "string",
      "enum": [
        "public_safe_smoke_fixture",
        "manual_opt_in_ready"
      ]
    },
    "target_runtime": {
      "type": "string",
      "enum": [
        "openclaw"
      ]
    },
    "target_profile": {
      "type": "string",
      "enum": [
        "openclaw_reference_agent"
      ]
    },
    "sandbox_contract_path": {
      "type": "string",
      "minLength": 1,
      "pattern": ".*\\S.*"
    },
    "mode": {
      "type": "string",
      "enum": [
        "metadata_only_public_safe_smoke"
      ]
    },
    "case_selection": {
      "type": "object",
      "additionalProperties": false,
      "required": [
        "case_source_paths",
        "case_ids",
        "case_count"
      ],
      "properties": {
        "case_source_paths": {
          "type": "array",
          "minItems": 1,
          "items": {
            "type": "string",
            "minLength": 1,
            "pattern": ".*\\S.*"
          }
        },
        "case_ids": {
          "type": "array",
          "minItems": 1,
          "items": {
            "type": "string",
            "minLength": 1,
            "pattern": ".*\\S.*"
          }
        },
        "case_count": {
          "type": "integer",
          "minimum": 1
        }
      }
    },
    "runtime_controls": {
      "type": "object",
      "additionalProperties": false,
      "required": [
        "opt_in_required",
        "opt_in_flag",
        "environment_variable",
        "live_execution_allowed",
        "tools_disabled_or_sandboxed",
        "network_access",
        "credentials_required",
        "external_actions",
        "raw_output_local_only",
        "disposable_workspace_required"
      ],
      "properties": {
        "opt_in_required": {
          "type": "boolean"
        },
        "opt_in_flag": {
          "type": "string",
          "minLength": 1,
          "pattern": ".*\\S.*"
        },
        "environment_variable": {
          "type": "string",
          "minLength": 1,
          "pattern": ".*\\S.*"
        },
        "live_execution_allowed": {
          "type": "boolean"
        },
        "tools_disabled_or_sandboxed": {
          "type": "boolean"
        },
        "network_access": {
          "type": "boolean"
        },
        "credentials_required": {
          "type": "boolean"
        },
        "external_actions": {
          "type": "boolean"
        },
        "raw_output_local_only": {
          "type": "boolean"
        },
        "disposable_workspace_required": {
          "type": "boolean"
        }
      }
    },
    "outputs": {
      "type": "object",
      "additionalProperties": false,
      "required": [
        "raw_output_path",
        "normalized_transcript_path",
        "tool_summary_path",
        "scored_trace_path",
        "report_path",
        "raw_outputs_committable",
        "normalized_outputs_committable"
      ],
      "properties": {
        "raw_output_path": {
          "type": "string",
          "minLength": 1,
          "pattern": ".*\\S.*"
        },
        "normalized_transcript_path": {
          "type": "string",
          "minLength": 1,
          "pattern": ".*\\S.*"
        },
        "tool_summary_path": {
          "type": "string",
          "minLength": 1,
          "pattern": ".*\\S.*"
        },
        "scored_trace_path": {
          "type": "string",
          "minLength": 1,
          "pattern": ".*\\S.*"
        },
        "report_path": {
          "type": "string",
          "minLength": 1,
          "pattern": ".*\\S.*"
        },
        "raw_outputs_committable": {
          "type": "boolean"
        },
        "normalized_outputs_committable": {
          "type": "boolean"
        }
      }
    },
    "promotion_path": {
      "type": "object",
      "additionalProperties": false,
      "required": [
        "promotion_format",
        "validator",
        "replay_command",
        "review_notes_required",
        "private_raw_output_retained"
      ],
      "properties": {
        "promotion_format": {
          "type": "string",
          "enum": [
            "saved_transcript_jsonl"
          ]
        },
        "validator": {
          "type": "string",
          "minLength": 1,
          "pattern": ".*\\S.*"
        },
        "replay_command": {
          "type": "string",
          "minLength": 1,
          "pattern": ".*\\S.*"
        },
        "review_notes_required": {
          "type": "boolean"
        },
        "private_raw_output_retained": {
          "type": "boolean"
        }
      }
    },
    "quality_gate": {
      "type": "object",
      "additionalProperties": false,
      "required": [
        "adapter_plan_validation_in_quality_gate",
        "public_safe_fixture_generation_in_quality_gate",
        "saved_transcript_replay_in_quality_gate",
        "live_openclaw_execution_in_quality_gate",
        "tool_execution_in_quality_gate",
        "raw_output_validation_in_quality_gate",
        "reason"
      ],
      "properties": {
        "adapter_plan_validation_in_quality_gate": {
          "type": "boolean"
        },
        "public_safe_fixture_generation_in_quality_gate": {
          "type": "boolean"
        },
        "saved_transcript_replay_in_quality_gate": {
          "type": "boolean"
        },
        "live_openclaw_execution_in_quality_gate": {
          "type": "boolean"
        },
        "tool_execution_in_quality_gate": {
          "type": "boolean"
        },
        "raw_output_validation_in_quality_gate": {
          "type": "boolean"
        },
        "reason": {
          "type": "string",
          "minLength": 1,
          "pattern": ".*\\S.*"
        }
      }
    },
    "safety_assertions": {
      "type": "object",
      "additionalProperties": false,
      "required": [
        "public_safe",
        "live_execution",
        "tool_execution",
        "external_actions",
        "contains_private_data",
        "credentials_required",
        "raw_private_logs"
      ],
      "properties": {
        "public_safe": {
          "type": "boolean",
          "const": true
        },
        "live_execution": {
          "type": "boolean",
          "const": false
        },
        "tool_execution": {
          "type": "boolean",
          "const": false
        },
        "external_actions": {
          "type": "boolean",
          "const": false
        },
        "contains_private_data": {
          "type": "boolean",
          "const": false
        },
        "credentials_required": {
          "type": "boolean",
          "const": false
        },
        "raw_private_logs": {
          "type": "boolean",
          "const": false
        }
      }
    },
    "smoke_transcript": {
      "type": "object"
    },
    "tool_call_summaries": {
      "type": "array",
      "minItems": 1,
      "items": {
        "type": "object"
      }
    }
  }
}
